{
  "schema_version": 2,
  "target_date": "2026-08-12",
  "previous_trading_day": "2026-08-10",
  "research_cutoff": "2026-08-10T20:00:00+09:00",
  "research_executed_at": "2026-08-11T13:16:38+09:00",
  "research_window": {
    "run_type": "FIRST_RUN",
    "window_start": "2026-08-09T20:00:00+09:00",
    "window_end": "2026-08-10T20:00:00+09:00",
    "previous_research_cutoff": null,
    "previous_run_date": null,
    "bootstrap_lookback_days": 1
  },
  "market_filter": "ALL_MARKETS",
  "overall_status": "DATA_UNAVAILABLE",
  "discovery": [
    {
      "discovery_type": "VOLUME_RANKING",
      "source_id": "YAHOO_JP_VOLUME_RANKING",
      "status": "FOUND",
      "source_url": "https://finance.yahoo.co.jp/stocks/ranking/volume?market=all",
      "retrieved_at": "2026-08-11T12:57:36+09:00",
      "result_count": 50,
      "items": [
        {
          "ticker": "8918",
          "company_name": "(株)ランド",
          "market": "東証STD",
          "rank": 1,
          "display_value": "257,953,800",
          "disclosure_datetime": null,
          "title": "volume: 257,953,800; close: 10; updated: 2026/08/10 18:40",
          "source_url": "https://finance.yahoo.co.jp/quote/8918.T",
          "retrieved_at": "2026-08-11T12:57:36+09:00"
        },
        {
          "ticker": "9432",
          "company_name": "ＮＴＴ(株)",
          "market": "東証PRM",
          "rank": 2,
          "display_value": "227,940,200",
          "disclosure_datetime": null,
          "title": "volume: 227,940,200; close: 159.9; updated: 2026/08/10 18:40",
          "source_url": "https://finance.yahoo.co.jp/quote/9432.T",
          "retrieved_at": "2026-08-11T12:57:36+09:00"
        },
        {
          "ticker": "4564",
          "company_name": "オンコセラピー・サイエンス(株)",
          "market": "東証GRT",
          "rank": 3,
          "display_value": "173,539,100",
          "disclosure_datetime": null,
          "title": "volume: 173,539,100; close: 19; updated: 2026/08/10 18:40",
          "source_url": "https://finance.yahoo.co.jp/quote/4564.T",
          "retrieved_at": "2026-08-11T12:57:36+09:00"
        },
        {
          "ticker": "1360",
          "company_name": "日経平均ベア2倍上場投信",
          "market": "東証ETF",
          "rank": 4,
          "display_value": "119,614,900",
          "disclosure_datetime": null,
          "title": "volume: 119,614,900; close: 66; updated: 2026/08/10 18:40",
          "source_url": "https://finance.yahoo.co.jp/quote/1360.T",
          "retrieved_at": "2026-08-11T12:57:36+09:00"
        },
        {
          "ticker": "5803",
          "company_name": "(株)フジクラ",
          "market": "東証PRM",
          "rank": 5,
          "display_value": "118,555,300",
          "disclosure_datetime": null,
          "title": "volume: 118,555,300; close: 5,580; updated: 2026/08/10 18:40",
          "source_url": "https://finance.yahoo.co.jp/quote/5803.T",
          "retrieved_at": "2026-08-11T12:57:36+09:00"
        },
        {
          "ticker": "8729",
          "company_name": "ソニーフィナンシャルグループ(株)",
          "market": "東証PRM",
          "rank": 6,
          "display_value": "104,721,200",
          "disclosure_datetime": null,
          "title": "volume: 104,721,200; close: 156.3; updated: 2026/08/10 18:40",
          "source_url": "https://finance.yahoo.co.jp/quote/8729.T",
          "retrieved_at": "2026-08-11T12:57:36+09:00"
        },
        {
          "ticker": "4597",
          "company_name": "ソレイジア・ファーマ(株)",
          "market": "東証GRT",
          "rank": 7,
          "display_value": "70,590,700",
          "disclosure_datetime": null,
          "title": "volume: 70,590,700; close: 31; updated: 2026/08/10 18:40",
          "source_url": "https://finance.yahoo.co.jp/quote/4597.T",
          "retrieved_at": "2026-08-11T12:57:36+09:00"
        },
        {
          "ticker": "9434",
          "company_name": "ソフトバンク(株)",
          "market": "東証PRM",
          "rank": 8,
          "display_value": "61,617,100",
          "disclosure_datetime": null,
          "title": "volume: 61,617,100; close: 228.4; updated: 2026/08/10 18:40",
          "source_url": "https://finance.yahoo.co.jp/quote/9434.T",
          "retrieved_at": "2026-08-11T12:57:36+09:00"
        },
        {
          "ticker": "5801",
          "company_name": "古河電気工業(株)",
          "market": "東証PRM",
          "rank": 9,
          "display_value": "45,988,600",
          "disclosure_datetime": null,
          "title": "volume: 45,988,600; close: 3,952; updated: 2026/08/10 18:40",
          "source_url": "https://finance.yahoo.co.jp/quote/5801.T",
          "retrieved_at": "2026-08-11T12:57:36+09:00"
        },
        {
          "ticker": "8136",
          "company_name": "(株)サンリオ",
          "market": "東証PRM",
          "rank": 10,
          "display_value": "44,026,000",
          "disclosure_datetime": null,
          "title": "volume: 44,026,000; close: 1,454.5; updated: 2026/08/10 18:40",
          "source_url": "https://finance.yahoo.co.jp/quote/8136.T",
          "retrieved_at": "2026-08-11T12:57:36+09:00"
        },
        {
          "ticker": "5401",
          "company_name": "日本製鉄(株)",
          "market": "東証PRM",
          "rank": 11,
          "display_value": "41,130,600",
          "disclosure_datetime": null,
          "title": "volume: 41,130,600; close: 689.4; updated: 2026/08/10 18:40",
          "source_url": "https://finance.yahoo.co.jp/quote/5401.T",
          "retrieved_at": "2026-08-11T12:57:36+09:00"
        },
        {
          "ticker": "285A",
          "company_name": "キオクシアホールディングス(株)",
          "market": "東証PRM",
          "rank": 12,
          "display_value": "32,549,100",
          "disclosure_datetime": null,
          "title": "volume: 32,549,100; close: 48,010; updated: 2026/08/10 18:40",
          "source_url": "https://finance.yahoo.co.jp/quote/285A.T",
          "retrieved_at": "2026-08-11T12:57:36+09:00"
        },
        {
          "ticker": "2146",
          "company_name": "ＵＴグループ(株)",
          "market": "東証PRM",
          "rank": 13,
          "display_value": "31,256,100",
          "disclosure_datetime": null,
          "title": "volume: 31,256,100; close: 221; updated: 2026/08/10 18:40",
          "source_url": "https://finance.yahoo.co.jp/quote/2146.T",
          "retrieved_at": "2026-08-11T12:57:36+09:00"
        },
        {
          "ticker": "8306",
          "company_name": "(株)三菱ＵＦＪフィナンシャル・グループ",
          "market": "東証PRM",
          "rank": 14,
          "display_value": "30,256,700",
          "disclosure_datetime": null,
          "title": "volume: 30,256,700; close: 3,510; updated: 2026/08/10 18:40",
          "source_url": "https://finance.yahoo.co.jp/quote/8306.T",
          "retrieved_at": "2026-08-11T12:57:36+09:00"
        },
        {
          "ticker": "7201",
          "company_name": "日産自動車(株)",
          "market": "東証PRM",
          "rank": 15,
          "display_value": "29,478,400",
          "disclosure_datetime": null,
          "title": "volume: 29,478,400; close: 350; updated: 2026/08/10 18:40",
          "source_url": "https://finance.yahoo.co.jp/quote/7201.T",
          "retrieved_at": "2026-08-11T12:57:36+09:00"
        },
        {
          "ticker": "9984",
          "company_name": "ソフトバンクグループ(株)",
          "market": "東証PRM",
          "rank": 16,
          "display_value": "28,638,800",
          "disclosure_datetime": null,
          "title": "volume: 28,638,800; close: 5,484; updated: 2026/08/10 18:40",
          "source_url": "https://finance.yahoo.co.jp/quote/9984.T",
          "retrieved_at": "2026-08-11T12:57:36+09:00"
        },
        {
          "ticker": "3664",
          "company_name": "(株)ＷＩＺＥ",
          "market": "東証GRT",
          "rank": 17,
          "display_value": "27,051,400",
          "disclosure_datetime": null,
          "title": "volume: 27,051,400; close: 22; updated: 2026/08/10 18:40",
          "source_url": "https://finance.yahoo.co.jp/quote/3664.T",
          "retrieved_at": "2026-08-11T12:57:36+09:00"
        },
        {
          "ticker": "9501",
          "company_name": "東京電力ホールディングス(株)",
          "market": "東証PRM",
          "rank": 18,
          "display_value": "25,148,300",
          "disclosure_datetime": null,
          "title": "volume: 25,148,300; close: 521.5; updated: 2026/08/10 18:40",
          "source_url": "https://finance.yahoo.co.jp/quote/9501.T",
          "retrieved_at": "2026-08-11T12:57:36+09:00"
        },
        {
          "ticker": "5802",
          "company_name": "住友電気工業(株)",
          "market": "東証PRM",
          "rank": 19,
          "display_value": "24,032,000",
          "disclosure_datetime": null,
          "title": "volume: 24,032,000; close: 2,161; updated: 2026/08/10 18:40",
          "source_url": "https://finance.yahoo.co.jp/quote/5802.T",
          "retrieved_at": "2026-08-11T12:57:36+09:00"
        },
        {
          "ticker": "4751",
          "company_name": "(株)サイバーエージェント",
          "market": "東証PRM",
          "rank": 20,
          "display_value": "24,031,200",
          "disclosure_datetime": null,
          "title": "volume: 24,031,200; close: 1,249; updated: 2026/08/10 18:40",
          "source_url": "https://finance.yahoo.co.jp/quote/4751.T",
          "retrieved_at": "2026-08-11T12:57:36+09:00"
        },
        {
          "ticker": "2181",
          "company_name": "パーソルホールディングス(株)",
          "market": "東証PRM",
          "rank": 21,
          "display_value": "23,547,500",
          "disclosure_datetime": null,
          "title": "volume: 23,547,500; close: 282.2; updated: 2026/08/10 18:40",
          "source_url": "https://finance.yahoo.co.jp/quote/2181.T",
          "retrieved_at": "2026-08-11T12:57:36+09:00"
        },
        {
          "ticker": "7203",
          "company_name": "トヨタ自動車(株)",
          "market": "東証PRM",
          "rank": 22,
          "display_value": "23,489,400",
          "disclosure_datetime": null,